{
  "artifact_id": "aa:04af1323-5134-4834-9595-79a848b709e0",
  "authority_id": "auth:alice:001",
  "authority_state_hash": "9f4d9ad8ad9bb9848ea069ce2efbe1fff5f601ea72134b8283477c72397e79a4",
  "cp_signature": "4v-RCnDqGjfckRiTtmCKhGzjx0Wjlj2FYldqLMqswQSglTpLTL306EhAjYxErQMHUXNbHIxINkKMOGry205UBA",
  "decision": "DENY",
  "intent_hash": "3b5ac587741f85d05265be6eeabfc080f76299276947716627773e97967d81ba",
  "nonce": "5f7ca77e0bd5503677b8cd3cbeedafd4941ba9bde2c182b41ff9caee96e3f61a",
  "permit_id": "60ba7bf5-84b3-4075-9fd7-b91cfeb2d9dd",
  "policy_hash": "fa8b919c909d5eb9e373d090928170eb0e7936ac20ccf413332b96520903168e",
  "prev_artifact_hash": "9e37a6d971427a75d315b2aa44608e0de72c8b8bed4895c5a18a01e24eaa8802",
  "principal_id": "principal:alice",
  "reason_code": "REPLAY",
  "result_hash": "74234e98afe7498fb5daf1f36ac2d78acc339464f950703b8c019892f982b90b",
  "scope_hash": "af6019d35f03297e649a2ea5a4ddd9fc56ae5a507a51c55ca8fb8a8628390bba",
  "timestamp": 1787815309
}